{
  "schemaVersion": 2,
  "id": "concept-drift-survey",
  "paperId": "doi:10.1145/2523813",
  "revision": 2,
  "title": "概念漂移综述：旧规律何时失效，系统怎样适应",
  "paperTitle": "A Survey on Concept Drift Adaptation",
  "language": "zh-Hans",
  "type": "survey",
  "mode": "deep",
  "purpose": "理解非平稳数据中的预测失效，建立记忆、检测、学习与损失估计的概念地图，辨别漂移与状态变化，并掌握遵守时间顺序的适应评价及其边界。",
  "source": {
    "id": "doi:10.1145/2523813",
    "version": "author accepted manuscript; 44 pages; SHA-256 prefix 3bb1c56b9eea",
    "url": "https://mpechen.win.tue.nl/publications/pubs/Gama_ACMCS_AdaptationCD_accepted.pdf"
  },
  "bodyFile": "concept-drift-survey.md",
  "bodySha256": "82a7b7bccbcc9ae9dffef46c83272540804685117eb1bacb64db7eb87453f3ef",
  "units": [
    {
      "id": "orientation",
      "heading": null
    },
    {
      "id": "u01",
      "heading": "变化的是一次观察，还是产生观察的规律"
    },
    {
      "id": "u02",
      "heading": "漂移的时间形态决定适应难点"
    },
    {
      "id": "u03",
      "heading": "把预测、诊断和更新分成可组合的环节"
    },
    {
      "id": "u04",
      "heading": "保留什么：窗口、衰减与旧模型的不同作用"
    },
    {
      "id": "u05",
      "heading": "怎样发现变化：监视的信号比算法名字更重要"
    },
    {
      "id": "u06",
      "heading": "发现之后怎样改：更新、替换与集成"
    },
    {
      "id": "u07",
      "heading": "怎样证明适应有效：先预测，再用答案学习"
    },
    {
      "id": "u08",
      "heading": "检测分数、任务表现与资源成本需要一起看"
    },
    {
      "id": "u09",
      "heading": "应用条件与面向 Agent 的边界"
    },
    {
      "id": "u10",
      "heading": "原文阅读入口与覆盖说明"
    }
  ],
  "citations": [
    {
      "id": "c-drift-1",
      "url": "https://doi.org/10.1145/2523813",
      "labels": [
        "正式文献记录"
      ],
      "role": "background",
      "sourceVersion": "ACM Computing Surveys 46(4), Article 44 (2014) publication record"
    },
    {
      "id": "c-drift-2",
      "url": "https://mpechen.win.tue.nl/publications/pubs/Gama_ACMCS_AdaptationCD_accepted.pdf",
      "labels": [
        "作者接收稿，物理页1–2",
        "接收稿 §2.1，物理页3–5",
        "接收稿 §2.1及图1，物理页4–5",
        "接收稿 §2.2及图2，物理页5–6",
        "接收稿 §2.4、§3及图3–4，物理页6–7、10–11",
        "接收稿 §2.4、§3.5，物理页6–7、25",
        "接收稿 §3.1及图5，物理页10–12",
        "接收稿 §3.1.1，物理页11–12",
        "接收稿 §3.1.2及表I，物理页12–14",
        "接收稿 §3.2、图6及表II–III，物理页13–19",
        "接收稿 §3.2.1，物理页14–15",
        "接收稿 §3.2.2，物理页15–16",
        "接收稿 §3.2.3，物理页16–18；附录算法2，物理页36",
        "接收稿 §3.3.1–3.3.2及图7，物理页19–21",
        "接收稿 §3.3.2，物理页21–22",
        "接收稿 §3.3.3及表IV，物理页22–24",
        "接收稿 §3.2.3脚注、§3.4及图8，物理页17、23–25",
        "接收稿 §4.2.1，物理页26–27",
        "接收稿 §4.2.1；附录C及图11，物理页27、43",
        "接收稿 §4.2.1–4.2.3及图9，物理页27–28",
        "接收稿 §4.1，物理页25–26",
        "接收稿 §4.3及附录B，物理页28–29、38–41",
        "接收稿附录C及图12，物理页43–44",
        "接收稿 §2.5.1–2.5.4，物理页7–10",
        "接收稿 §5，物理页29",
        "原文入口：接收稿 §2–4与附录C，物理页3–28、43–44"
      ],
      "role": "primary",
      "sourceVersion": "author accepted manuscript; 44 pages; SHA-256 prefix 3bb1c56b9eea"
    }
  ],
  "related": [
    {
      "guideId": "agent-memory-survey",
      "relation": "editorial-reading-order"
    },
    {
      "guideId": "helm",
      "relation": "editorial-reading-order"
    },
    {
      "guideId": "streamingllm",
      "relation": "editorial-reading-order"
    }
  ],
  "assets": [],
  "coverage": {
    "scope": "mainline",
    "basis": "sections",
    "sections": [
      "Author accepted manuscript §1–2: problem, distributions, drift types, online procedure and applications; physical pp1–10",
      "§3.1–3.5: memory, change detection, learning, loss estimation and feedback constraints; physical pp10–25",
      "§4.1–4.3 and §5: evaluation and limitations; physical pp25–29",
      "Appendix A–B: selected algorithm and dataset checks, physical pp36–41; Appendix C evaluation narrative and Figures 11–12, physical pp43–44"
    ],
    "figuresViewed": [
      "Figure 1–2, physical p5: conditional/input shifts and temporal forms",
      "Figure 3, physical p7: prediction, feedback, diagnosis and optional detector",
      "Figure 4–5, physical p11: modules and memory taxonomy",
      "Figure 6 and Table I, physical p14: detector and memory categories",
      "Figure 7 and Tables II–III, physical p19: learner axes and detection complexity",
      "Figure 8 and Table IV, physical p24: loss estimation and learning categories",
      "Table V, physical p25: loss estimation categories",
      "Figure 9, physical p28: tuning versus held-out data streams",
      "Figure 11, physical p43: holdout, landmark and sliding-window evaluation",
      "Figure 12, physical p44: RBF accuracy, Kappa and RAM-Hours trade-off"
    ],
    "limitations": [
      "实际主源为44页作者接收稿，含在线附录；未把占位2013页脚和DOI当作正式出版信息，也未与37页正式出版版及其附件逐字比较。",
      "这是2014文献的问题与方法主线，不涵盖其后的完整研究进展；历史展望不代表当前研究空白。",
      "附录伪代码、数据集与被引研究只作选择性核对，没有逐项复核、代码执行或实验复现；不构成full-survey。",
      "主要讨论监督预测中的真实概念漂移；无标签检测、闭环行动评价、大模型生成并发与信念修订仅说明边界，不宣称已被解决。"
    ],
    "reviewBasis": "直接阅读作者公开接收稿的§1–5及选择性附录，核对正式DOI出版记录与作者顺序；下载件SHA-256为3bb1c56b9eeae5878da926a6a7fd4e087a5fcd1da0af5bfb9c8b18b8282ddefa。用PDF渲染像素检查图1–9、11–12及表I–V所在页面，核查概念类型、模块关系和评价图例。没有声称复现实验；本字段记录来源核查，不代替独立内容审阅。"
  },
  "orientation": {
    "shortTitle": "概念漂移：检测、适应与在线评价",
    "topics": [
      {
        "id": "concept-drift",
        "label": "概念漂移",
        "aliases": [
          "concept drift",
          "非平稳环境",
          "分布变化"
        ]
      },
      {
        "id": "adaptive-learning",
        "label": "在线适应",
        "aliases": [
          "online adaptive learning",
          "遗忘",
          "变化检测"
        ]
      },
      {
        "id": "prequential-evaluation",
        "label": "流式评价",
        "aliases": [
          "prequential",
          "test-then-train",
          "检测延迟"
        ]
      }
    ],
    "summary": "从联合与条件分布解释旧规律何时失效，再用记忆、检测、学习和损失估计拆解适应机制；评价部分解释时间顺序、窗口、反馈延迟以及任务效果与资源成本的权衡。",
    "value": "为持续运行系统建立非平稳环境的理论入口，避免把新观察、漂移警报、模型更新与长期效果混为一谈，并识别流式实验中的未来信息泄漏和评价范围问题。",
    "prerequisites": [
      "了解监督学习中的特征、标签、预测和误差；正文补充条件分布与窗口的必要概念。",
      "可结合Agent记忆综述理解保留与遗忘，结合HELM理解评价条件；两者都是编辑阅读联系。"
    ],
    "boundaries": [
      "主源是含附录的作者接收稿，正式文献发表于2014；接收稿排版与出版版不能混用页码。",
      "mainline范围覆盖主要概念与机制，未复现算法，也不提供当前方法排名。",
      "面向Agent的联系是教学解释；本文不解决大模型推理中途接收观察、完整信念修订或行动规划。"
    ],
    "bibliography": {
      "authors": [
        "João Gama",
        "Indrė Žliobaitė",
        "Albert Bifet",
        "Mykola Pechenizkiy",
        "Abdelhamid Bouchachia"
      ],
      "year": 2014,
      "venue": "ACM Computing Surveys 46(4), Article 44",
      "publicationKind": "journal",
      "url": "https://doi.org/10.1145/2523813",
      "preprintYear": null
    },
    "readingTargets": [
      {
        "unitId": "u01",
        "purpose": "区分状态变化、输入分布变化与条件预测关系变化。",
        "concepts": [
          "联合分布",
          "真实概念漂移",
          "虚拟漂移"
        ],
        "limit": "单个新观察不足以证明漂移，条件概率变化也不必改变每个输入的最优类别。"
      },
      {
        "unitId": "u03",
        "purpose": "沿预测、反馈、诊断和更新理解四模块怎样组合。",
        "concepts": [
          "记忆",
          "在线适应",
          "损失估计",
          "变化检测",
          "标签延迟"
        ],
        "limit": "监督反馈可能迟到或缺失，检测器并非所有适应策略的必需组件。"
      },
      {
        "unitId": "u04",
        "purpose": "比较窗口、降权与保存旧模型对历史信息的不同假设。",
        "concepts": [
          "滑动窗口",
          "渐进遗忘",
          "抽样",
          "概念重现"
        ],
        "limit": "近期并不总等于相关；这里的模型记忆不直接等同于Agent文本记忆。"
      },
      {
        "unitId": "u05",
        "purpose": "解释序贯、控制图、双窗口和上下文检测分别监视什么。",
        "concepts": [
          "CUSUM",
          "统计过程控制",
          "ADWIN",
          "上下文"
        ],
        "limit": "本文解释机制与条件，不提供经过复现的实现规范或通用阈值保证。"
      },
      {
        "unitId": "u07",
        "purpose": "区分训练、检测和评价窗口，理解先预测后训练。",
        "concepts": [
          "prequential",
          "test-then-train",
          "时序评价",
          "反馈延迟"
        ],
        "limit": "窗口估计与独立测试集的关系取决于数据和假设，不能凭单个曲线推广。"
      },
      {
        "unitId": "u08",
        "purpose": "联合判断检测质量、任务效果与资源代价。",
        "concepts": [
          "误报",
          "检测延迟",
          "合成漂移",
          "RAM-Hours"
        ],
        "limit": "图12是特定RBF设置的结果，真实数据加人工漂移不等于自然漂移验证。"
      }
    ]
  }
}
